{
  "schema_version": "1.0.0",
  "transaction": {
    "transaction_id": "tx_blocked_r1",
    "provider": "wallet_provider_1",
    "provider_tx_id": null,
    "initiator_user_id": "user_001",
    "source_wallet_id": "wallet_001",
    "destination_wallet_id": "wallet_002",
    "amount": 350.0,
    "currency": "PYC",
    "transaction_type": "P2P",
    "direction": "outgoing",
    "status": "PENDING",
    "reason_code": null,
    "created_at": "2026-01-21T12:00:00Z",
    "provider_created_at": null,
    "executed_at": null,
    "country": "FR",
    "city": null,
    "description": null,
    "metadata": null
  },
  "context": {
    "source_wallet": {
      "wallet_id": "wallet_001",
      "balance": 1000.0,
      "status": "active",
      "created_at": "2025-01-01T00:00:00Z",
      "account_age_minutes": 525600.0
    },
    "destination_wallet": {
      "wallet_id": "wallet_002",
      "status": "active"
    },
    "user": {
      "user_id": "user_001",
      "status": "active",
      "risk_level": "low"
    }
  },
  "features": {
    "transactional": {
      "amount": 350.0,
      "log_amount": 5.857933154483459,
      "currency_is_pyc": true,
      "direction_outgoing": 1,
      "direction_incoming": 0,
      "transaction_type_p2p": 1,
      "transaction_type_merchant": 0,
      "transaction_type_cashin": 0,
      "transaction_type_cashout": 0,
      "hour_of_day": 12,
      "day_of_week": 2,
      "country_fr": 1,
      "country_be": 0,
      "country_kp": 0
    },
    "historical": {
      "avg_amount_30d": 85.5,
      "tx_last_10min": 0,
      "is_new_beneficiary": false,
      "user_country_history": ["FR"],
      "blocked_tx_last_24h": 0,
      "src_tx_count_out_1h": 0,
      "src_tx_amount_mean_out_1h": null
    }
  }
}

