{
  "schema_version": "1.0.0",
  "transaction": {
    "transaction_id": "tx_001",
    "provider": "wallet_provider_1",
    "provider_tx_id": "wp_tx_12345",
    "initiator_user_id": "user_123",
    "source_wallet_id": "wallet_src_456",
    "destination_wallet_id": "wallet_dst_789",
    "amount": 150.0,
    "currency": "PYC",
    "transaction_type": "P2P",
    "direction": "outgoing",
    "status": "PENDING",
    "reason_code": null,
    "created_at": "2026-01-21T12:00:00Z",
    "provider_created_at": "2026-01-21T12:00:01Z",
    "executed_at": null,
    "country": "FR",
    "city": "Paris",
    "description": "Paiement restaurant",
    "metadata": {
      "raw_provider_payload": {
        "provider_ref": "wp_ref_12345",
        "timestamp": "2026-01-21T12:00:01Z"
      }
    }
  },
  "context": {
    "source_wallet": {
      "wallet_id": "wallet_src_456",
      "balance": 1000.0,
      "status": "active",
      "created_at": "2025-01-01T00:00:00Z",
      "account_age_minutes": 525600.0
    },
    "destination_wallet": {
      "wallet_id": "wallet_dst_789",
      "status": "active",
      "created_at": "2025-06-01T00:00:00Z"
    },
    "user": {
      "user_id": "user_123",
      "status": "active",
      "risk_level": "low",
      "created_at": "2024-12-01T00:00:00Z"
    }
  },
  "features": {
    "transactional": {
      "amount": 150.0,
      "log_amount": 5.0106352940962555,
      "currency_is_pyc": true,
      "direction_outgoing": 1,
      "direction_incoming": 0,
      "transaction_type_p2p": 1,
      "transaction_type_merchant": 0,
      "transaction_type_cashin": 0,
      "transaction_type_cashout": 0,
      "hour_of_day": 12,
      "day_of_week": 2,
      "country_fr": 1,
      "country_be": 0,
      "country_kp": 0
    },
    "historical": {
      "avg_amount_30d": 85.5,
      "tx_last_10min": 3,
      "is_new_beneficiary": false,
      "user_country_history": ["FR", "BE", "DE"],
      "blocked_tx_last_24h": 0,
      "src_tx_count_out_5m": 0,
      "src_tx_count_out_1h": 2,
      "src_tx_count_out_24h": 15,
      "src_tx_count_out_7d": 45,
      "src_tx_amount_sum_out_1h": 200.0,
      "src_tx_amount_mean_out_1h": 100.0,
      "src_tx_amount_max_out_1h": 150.0,
      "src_unique_destinations_7d": 8,
      "is_new_destination_24h": false,
      "is_new_destination_7d": false,
      "is_new_destination_30d": true,
      "src_to_dst_tx_count_30d": 0,
      "days_since_last_src_to_dst": null,
      "src_destination_concentration_7d": 0.35,
      "src_destination_entropy_7d": 2.1,
      "is_new_country_30d": false,
      "country_mismatch": false,
      "src_failed_count_24h": 0,
      "src_failed_ratio_7d": 0.02
    }
  }
}

